Text,Entities
"The individual states that two cousins suffer from allergies where ""cousins"" and ""individual"" are (Person); ""allergies"" is (Finding) and refers to ""cousins"" (Person)",individual : (Person); cousins : (Person); allergies : (Finding)
"His uncle has a documented case of chronic bronchitis where ""uncle"" and ""His"" are (Person); ""chronic bronchitis"" is (Finding) and refers to ""uncle"" (Person)",His : (Person); uncle : (Person); chronic bronchitis : (Finding)
"The subject indicates that both grandparents experienced heart disease where ""grandparents"" and ""subject"" are (Person); ""heart disease"" is (Finding) and refers to ""grandparents"" (Person)",subject : (Person); grandparents : (Person); heart disease : (Finding)
The individual states that his two brothers have been treated for allergies.,"individual : (Person); brothers : (Person); allergies : (Finding) and refers to ""brothers"" (Person)"
Her father has a history of diabetes.,"her : (Person); father : (Person); diabetes : (Finding) and refers to ""father"" (Person)"
Family medical history includes a mother with hypertension and a sister diagnosed with eczema.,"Family : (Organization); mother : (Person); hypertension : (Finding) and refers to ""mother"" (Person); sister : (Person); eczema : (Finding) and refers to ""sister"" (Person)"
"""The individual mentioned that both siblings have a background of significant drug use, where 'siblings' and 'individual' are (Person); 'significant drug use' is (Finding) and 'significant' is a (Severity Qualifier) and refers to 'siblings' (Person); 'background of' is (Temporal Qualifier). The 70-year-old individual presented with a personal history of substance dependence and chronic drug-related complications. A 50-year-old female non-smoker with a history of substance use for nearly 15 years, with subsequent drug-related disorders identified five years prior.""",individual : (Person); siblings : (Person); significant drug use : (Finding); significant : (Severity Qualifier); background of : (Temporal Qualifier)
"""The individual disclosed that his mother struggled with a significant history of prescription drug misuse, while his father had been a heavy drinker, indicating a strong familial pattern of substance-related issues.""","Patient : (Person); mother : (Person); father : (Person); ""significant history of prescription drug misuse"" : (Finding); ""heavy drinker"" : (Finding); ""strong familial pattern of substance-related issues"" : (Finding); ""history of"" : (Temporal Qualifier)"
"""Upon evaluation, the 72-year-old patient indicated a past filled with alcohol dependency issues, compounded by a diagnosis of cirrhosis that was confirmed five years prior.""","Patient : (Person); ""past filled with alcohol dependency issues"" : (Finding); ""diagnosis of cirrhosis"" : (Finding); ""confirmed five years prior"" : (Temporal Qualifier)"
"""In the case of the 50-year-old female with a long-standing issue of cocaine dependence, her family history revealed both parents had battled substance-related problems, leading to a concerning environment.""","Patient : (Person); ""50-year-old female"" : (Person); ""long-standing issue of cocaine dependence"" : (Finding); parents : (Person); ""battled substance-related problems"" : (Finding); ""concerning environment"" : (Finding)"
"""The individual disclosed that his father struggled with significant alcohol dependency, which has raised concerns about hereditary patterns of addiction.""","Father : (Person); Individual : (Person); ""significant alcohol dependency"" : (Finding); ""significant"" : (Severity Qualifier); ""history of"" : (Temporal Qualifier)"
"""After excluding potential neurological causes (MRI results were normal), we suspected a possible withdrawal syndrome, considering the patient's reported history of substance use (family history remains unverified).""","Patient : (Person); ""substance use"" : (Finding); ""history of"" : (Temporal Qualifier)"
"""A 72-year-old male with a past medical history of alcohol use disorder and severe liver cirrhosis.""","72-year-old male : (Person); ""alcohol use disorder"" : (Finding); ""severe"" : (Severity Qualifier); ""liver cirrhosis"" : (Finding)"
"""This 53-year-old female presented with a long-term history of alcohol abuse leading to complications including pancreatitis.""","53-year-old female : (Person); ""alcohol abuse"" : (Finding); ""long-term"" : (Temporal Qualifier); ""pancreatitis"" : (Finding)"
"""The individual has a documented family background of significant drug dependency where ""individual"" and ""family"" are (Person); ""significant drug dependency"" is (Finding) and ""significant"" is a (Severity Qualifier) and refers to ""family"" (Person); ""documented background of"" is (Temporal Qualifier). The 72-year-old individual presents with a prior diagnosis of drug addiction and associated liver complications. A 55-year-old female with a smoking history and chronic drug dependence lasting around 15 years, leading to severe withdrawal symptoms recognized five years ago.""",individual : (Person); family : (Person); significant drug dependency : (Finding); significant : (Severity Qualifier); documented background of : (Temporal Qualifier)
"""The individual disclosed that their mother struggled with severe drug dependency while their father had a long-standing issue with alcohol abuse, leading to concerns about genetic predisposition to substance use disorders.""",Patient : (Person); mother : (Person); father : (Person); severe drug dependency : (Finding); alcohol abuse : (Finding); long-standing : (Temporal Qualifier)
"""After evaluating the patient, it was noted that the family has a significant background of substance abuse, particularly involving the father who has a history of severe opioid dependence. The patient, a 50-year-old female, reported that her mother was also an alcoholic, leading to her own struggles with alcohol over the past decade.""",Patient : (Person); father : (Person); mother : (Person); severe opioid dependence : (Finding); alcohol : (Finding); decade : (Temporal Qualifier)
"""In a recent evaluation, the patient disclosed that both of his parents suffered from severe alcohol dependency, which he believes has contributed to his own challenges with drinking. The 40-year-old male has been in recovery for five years but remains at risk due to this family history.""",Patient : (Person); parents : (Person); severe alcohol dependency : (Finding); alcohol : (Finding); five years : (Temporal Qualifier)
"""During the assessment, the 30-year-old male patient stated that his mother had a long-standing issue with alcohol, which he claims impacted his upbringing and led to his own battles with substance use. The family denies any current substance use despite the patient's history of alcohol abuse.""",Patient : (Person); mother : (Person); alcohol : (Finding); substance use : (Finding); battles : (Temporal Qualifier)
"""The evaluation indicated a significant concern regarding the patient's lifestyle, particularly as both siblings have a documented pattern of substance dependence, where 'siblings' and 'patient' are (Person); 'substance dependence' is (Finding) and 'significant' is a (Severity Qualifier) and refers to 'siblings' (Person); 'documented pattern of' is (Temporal Qualifier).""",sibling : (Person); patient : (Person); substance dependence : (Finding); significant : (Severity Qualifier); documented pattern of : (Temporal Qualifier)
"""The patient mentioned that his mother had a significant history of substance abuse, indicating a potential genetic predisposition to addiction.""","Patient : (Person); mother : (Person); ""significant history of substance abuse"" : (Finding); ""significant"" : (Severity Qualifier) and refers to ""history of substance abuse"" (Finding); ""genetic predisposition"" : (Temporal Qualifier)"
"""After extensive testing ruled out any neurological disorder, we suspected a withdrawal syndrome due to the abrupt cessation of alcohol intake, exacerbated by his long-standing dependence.""","""we"" : (Person); ""alcohol intake"" : (Finding); ""withdrawal syndrome"" : (Finding); ""long-standing dependence"" : (Temporal Qualifier)"
"""A 52-year-old female with a documented history of drug addiction and recurrent liver complications related to her condition was admitted for further evaluation.""","""52-year-old female"" : (Person); ""documented history of drug addiction"" : (Finding); ""recurrent liver complications"" : (Finding); ""related to her condition"" : (Temporal Qualifier)"
"""Following the assessment of the patient's cognitive decline (cognitive evaluations returning normal), we suspected it might be related to substance withdrawal, particularly given the patient's history of opioid use (the family states there is no current use, but they occasionally leave him unsupervised). The patient was referred to a mental health specialist to evaluate for patterns of substance use (the family insists that the patient has not used drugs, but their supervision is inconsistent) or alternative causes.""","Patient : (Person); ""substance withdrawal"" : (Finding); ""opioid use"" : (Finding); ""history of"" : (Temporal Qualifier); ""family"" : (Person); ""cognitive decline"" : (Finding)"
"""After conducting a thorough evaluation, we considered the possibility of a withdrawal syndrome in the patient, particularly given the family history of significant substance use (the blood tests did not reveal any abnormalities, but the patient has exhibited concerning behavior patterns). The patient was then referred to a specialist to investigate potential substance use issues (the relatives assert that the patient has not engaged in any substance use, although they are not always present to monitor him) or other underlying conditions.""","Patient : (Person); ""family history of significant substance use"" : (Finding); ""significant"" : (Severity Qualifier); ""substance use"" : (Finding); ""withdrawal syndrome"" : (Finding); ""relatives"" : (Person)"
"""A 65-year-old male patient reported experiencing shortness of breath for the past five months, which he attributed to his history of smoking.""","Patient: (Person); ""shortness of breath"" : (Finding); ""five months"" : (Temporal Qualifier)"
"""This is a 72-year-old female patient with a family history of ovarian cancer, diagnosed in her sister at the age of 50.""","Patient: (Person); ""ovarian cancer"" : (Finding); ""sister"" : (Person); ""50"" : (Temporal Qualifier)"
"""A 45-year-old female patient presents with abdominal pain that has persisted for three weeks, noting that her mother had a history of colon cancer.""","Patient: (Person); ""abdominal pain"" : (Finding); ""three weeks"" : (Temporal Qualifier); ""mother"" : (Person); ""colon cancer"" : (Finding)"
"""A 72-year-old man mentioned that his brother had a diagnosis of prostate cancer, and he has been experiencing discomfort in his lower abdomen for several months.""",brother : (Person); man : (Person); prostate cancer : (Finding); discomfort : (Finding); lower abdomen : (Finding)
"""A 72-year-old male patient mentioned that his uncle had a history of prostate cancer, which he feared might affect his own health.""",Patient: (Person); uncle: (Person); prostate cancer: (Finding); history of: (Temporal Qualifier)
"""This is a 45-year-old female patient who reported a family history of ovarian cancer with her mother diagnosed in 2010 and her sister diagnosed in 2015.""",Patient: (Person); mother: (Person); sister: (Person); ovarian cancer: (Finding); history of: (Temporal Qualifier)
"""A 55-year-old male patient disclosed that both his grandfathers had a history of colorectal cancer, which raised concerns for his own screenings.""",Patient: (Person); grandfathers: (Person); colorectal cancer: (Finding); history of: (Temporal Qualifier)
"""The 62-year-old female patient expressed anxiety over her family history, as her aunt had passed away from cervical cancer five years ago.""",Patient: (Person); aunt: (Person); cervical cancer: (Finding); history of: (Temporal Qualifier)
"""A 65-year-old male patient mentioned that his uncle was diagnosed with prostate cancer five years ago, and he is concerned about his own health.""",Patient: (Person); uncle: (Person); prostate cancer: (Finding); history of: (Temporal Qualifier)
"""This is a 45-year-old female patient who has been experiencing headaches for over a decade and fears the worst due to her father's brain tumor.""",Patient: (Person); father: (Person); brain tumor: (Finding); history of: (Temporal Qualifier)
"""The 50-year-old woman shared that her sister was treated for ovarian cancer two years prior, causing her to be vigilant about her own screenings.""",Patient: (Person); sister: (Person); ovarian cancer: (Finding); history of: (Temporal Qualifier)
"""A 70-year-old male patient reported that his mother had a history of colon cancer, which has made him more proactive about his health check-ups.""",Patient: (Person); mother: (Person); colon cancer: (Finding); history of: (Temporal Qualifier)
"""The 65-year-old male patient disclosed a family history of prostate cancer, stating that his father and uncle had both battled the disease.""",Patient : (Person); father : (Person); uncle : (Person); prostate cancer : (Finding); family history of : (Temporal Qualifier)
"""A 72-year-old female presented with chronic cough, noting that her mother was diagnosed with lung cancer five years ago.""",Patient : (Person); mother : (Person); lung cancer : (Finding); diagnosed with : (Temporal Qualifier)
"""This is a 45-year-old male patient who reported that his brother had a history of melanoma, which was treated successfully last year.""",Patient : (Person); brother : (Person); melanoma : (Finding); history of : (Temporal Qualifier)
"""The 50-year-old female patient mentioned that her sister has been living with ovarian cancer for over a decade.""",Patient : (Person); sister : (Person); ovarian cancer : (Finding); living with : (Temporal Qualifier)
"""A 38-year-old male reported that his maternal aunt had a long-standing history of colon cancer, diagnosed at age 55.""",Patient : (Person); maternal aunt : (Person); colon cancer : (Finding); history of : (Temporal Qualifier)
"""The 70-year-old female patient mentioned that her mother had a diagnosis of ovarian cancer during her lifetime.""",Patient: (Person); mother: (Person); ovarian cancer: (Finding); diagnosis of: (Temporal Qualifier)
"""A 45-year-old woman disclosed a family history of colorectal cancer affecting both her parents.""",woman: (Person); parents: (Person); colorectal cancer: (Finding); family history of: (Temporal Qualifier)
"""The 62-year-old man reported that his brother was diagnosed with prostate cancer five years ago.""",man: (Person); brother: (Person); prostate cancer: (Finding); diagnosed with: (Temporal Qualifier)
"""A 50-year-old female patient revealed that her aunt passed away due to pancreatic cancer.""",patient: (Person); aunt: (Person); pancreatic cancer: (Finding); passed away due to: (Temporal Qualifier)
"""The 38-year-old woman indicated a strong family history of thyroid cancer, particularly affecting her grandmother.""",woman: (Person); grandmother: (Person); thyroid cancer: (Finding); family history of: (Temporal Qualifier)
"""A 62-year-old man disclosed that his maternal uncle was diagnosed with prostate cancer five years ago, which led to significant family concerns regarding genetic predisposition.""",maternal uncle : (Person); prostate cancer : (Finding); 62-year-old man : (Person); five years ago : (Temporal Qualifier)
"""This 45-year-old female patient has a family history of ovarian cancer, as her sister was diagnosed with the disease three years back, raising awareness in her regarding her own health risks.""",sister : (Person); ovarian cancer : (Finding); 45-year-old female patient : (Person); three years back : (Temporal Qualifier)
"""A 70-year-old woman mentioned that her cousin had a significant battle with colon cancer, which prompted her to schedule a screening earlier than recommended.""",cousin : (Person); colon cancer : (Finding); 70-year-old woman : (Person)
"""A 62-year-old male patient reported a persistent cough that lasted for over a year, fearing it might indicate a serious condition.""","Patient: (Person); ""persistent cough"" : (Finding); ""year"" : (Temporal Qualifier)"
"""This is a 45-year-old female patient with a history of ovarian cancer diagnosed in 2010, and a family history of colorectal cancer.""","Patient: (Person); ""ovarian cancer"" : (Finding); ""history of"" : (Temporal Qualifier); ""colorectal cancer"" : (Finding)"
"""A 29-year-old female patient disclosed that her maternal uncle had been diagnosed with prostate cancer before passing away.""","Patient: (Person); ""maternal uncle"" : (Person); ""prostate cancer"" : (Finding); ""diagnosed with"" : (Temporal Qualifier)"
"""A 70-year-old female patient mentioned that her mother had a diagnosis of ovarian cancer and that her sister was also diagnosed with breast cancer.""",Patient : (Person); mother : (Person); sister : (Person); ovarian cancer : (Finding); breast cancer : (Finding); diagnosis of : (Temporal Qualifier)
"""This 62-year-old male patient reported a family history of prostate cancer, noting that both his father and uncle had been affected by the disease.""",Patient : (Person); father : (Person); uncle : (Person); prostate cancer : (Finding); history of : (Temporal Qualifier)
"""A 45-year-old woman disclosed that her maternal aunt had suffered from colorectal cancer, which prompted her to undergo regular screenings.""",Patient : (Person); maternal aunt : (Person); colorectal cancer : (Finding); suffered from : (Temporal Qualifier)
"""The 55-year-old male patient recounted that his brother had a long-standing history of melanoma, leading to increased vigilance in his own health checks.""",Patient : (Person); brother : (Person); melanoma : (Finding); long-standing history of : (Temporal Qualifier)
"""A 65-year-old female patient disclosed that her maternal aunt had been diagnosed with ovarian cancer ten years prior, which has raised concerns for her own health.""",Patient: (Person); maternal aunt: (Person); ovarian cancer: (Finding); ten years: (Temporal Qualifier)
"""The 72-year-old woman expressed worries after learning that her sister had battled colon cancer, which prompted her to seek medical advice.""",Patient: (Person); sister: (Person); colon cancer: (Finding); battled: (Temporal Qualifier)
"""A 45-year-old male patient revealed that his father had a significant history of prostate cancer, influencing his decision to undergo screening.""",Patient: (Person); father: (Person); prostate cancer: (Finding); history of: (Temporal Qualifier)
"""The 50-year-old female patient mentioned her cousin's struggle with cervical cancer, leading her to consider genetic testing.""",Patient: (Person); cousin: (Person); cervical cancer: (Finding); struggle with: (Temporal Qualifier)
"""An 88-year-old woman reported concerns related to her brother's previous diagnosis of melanoma, which has made her vigilant about her own skin health.""",Patient: (Person); brother: (Person); melanoma: (Finding); previous diagnosis of: (Temporal Qualifier)
