Text,Entities
"""Child, Hispanic, the second offspring of healthy parents (mother aged 32 and father aged 34), with no known genetic disorders or hypertension.""",parents : (Person); child : (Person); hypertension : (Finding)
"""Worried about potential hereditary conditions, she decided to get screened for high cholesterol.""",she : (Person); cholesterol : (Finding)
"""The adult disclosed that both grandparents had heart disease.""",grandparents : (Person); adult : (Person); heart disease : (Finding)
"The individual mentions that both aunts had a history of smoking, where ""aunts"" and ""individual"" are (Person); ""history of smoking"" is (Finding) and ""history"" a (Severity Qualifier) and refers to ""aunts"" (Person).",individual : (Person); aunts : (Person); history of smoking : (Finding); history : (Severity Qualifier)
"The patient indicates that both aunts had a history of smoking, where ""aunts"" and ""Patient"" are (Person); ""history of smoking"" is (Finding) and ""history"" a (Severity Qualifier) and refers to ""aunts"" (Person).",Patient: (Person); aunts: (Person); history of smoking: (Finding); history: (Severity Qualifier)
"The individual states that both aunts had a history of smoking where ""aunts"" and ""Individual"" are (Person); ""history of smoking"" is (Finding) and ""history"" a (Severity Qualifier) and refers to ""aunts"" (Person)",aunts : (Person); Individual : (Person); history of smoking : (Finding); history : (Severity Qualifier)
"The subject mentions that his grandfather suffered from hypertension where ""grandfather"" and ""Subject"" are (Person); ""suffered from hypertension"" is (Finding) and ""suffered"" a (Severity Qualifier) and refers to ""grandfather"" (Person)",grandfather : (Person); Subject : (Person); suffered from hypertension : (Finding); suffered : (Severity Qualifier)
"The woman indicates that her mother was diagnosed with diabetes where ""mother"" and ""Woman"" are (Person); ""diagnosed with diabetes"" is (Finding) and ""diagnosed"" a (Severity Qualifier) and refers to ""mother"" (Person)",mother : (Person); Woman : (Person); diagnosed with diabetes : (Finding); diagnosed : (Severity Qualifier)
"The child reveals that both grandparents were asthmatic where ""grandparents"" and ""Child"" are (Person); ""were asthmatic"" is (Finding) and ""were"" a (Severity Qualifier) and refers to ""grandparents"" (Person)",grandparents : (Person); Child : (Person); were asthmatic : (Finding); were : (Severity Qualifier)
"The patient mentions that both aunts had a history of smoking where ""aunts"" and ""Patient"" are (Person); ""history of smoking"" is (Finding) and ""history"" a (Severity Qualifier) and refers to ""aunts"" (Person)",Patient: (Person); aunts: (Person); history of smoking: (Finding); history: (Severity Qualifier)
"The patient indicates that his grandfather suffered from heart disease where ""grandfather"" and ""Patient"" are (Person); ""suffered from heart disease"" is (Finding) and ""suffered"" a (Severity Qualifier) and refers to ""grandfather"" (Person)",Patient: (Person); grandfather: (Person); suffered from heart disease: (Finding); suffered: (Severity Qualifier)
"The patient states that her mother had diabetes and hypertension where ""mother"" and ""Patient"" are (Person); ""diabetes and hypertension"" is (Finding) and ""diabetes"" a (Severity Qualifier) and refers to ""mother"" (Person)",Patient: (Person); mother: (Person); diabetes and hypertension: (Finding); diabetes: (Severity Qualifier)
"The patient reveals that both grandparents experienced strokes where ""grandparents"" and ""Patient"" are (Person); ""experienced strokes"" is (Finding) and ""experienced"" a (Severity Qualifier) and refers to ""grandparents"" (Person)",Patient: (Person); grandparents: (Person); experienced strokes: (Finding); experienced: (Severity Qualifier)
"The patient states that both aunts had a history of depression, where ""aunts"" and ""Patient"" are (Person); ""history of depression"" is (Finding) and ""history"" a (Severity Qualifier) and refers to ""aunts"" (Person)",Patient : (Person); aunts : (Person); history of depression : (Finding); history : (Severity Qualifier)
"The patient disclosed that both grandparents suffered from heart disease, where ""grandparents"" and ""Patient"" are (Person); ""suffered from heart disease"" is (Finding) and ""suffered"" a (Severity Qualifier) and refers to ""grandparents"" (Person)",Patient : (Person); grandparents : (Person); suffered from heart disease : (Finding); suffered : (Severity Qualifier)
"The patient mentioned that his cousin was diagnosed with asthma, where ""cousin"" and ""Patient"" are (Person); ""diagnosed with asthma"" is (Finding) and ""diagnosed"" a (Severity Qualifier) and refers to ""cousin"" (Person)",Patient : (Person); cousin : (Person); diagnosed with asthma : (Finding); diagnosed : (Severity Qualifier)
"The individual discloses that both aunts had a history of smoking, where ""aunts"" and ""individual"" are (Person); ""history of smoking"" is (Finding) and ""history"" a (Severity Qualifier) and refers to ""aunts"" (Person).",individual : (Person); aunts : (Person); history of smoking : (Finding); history : (Severity Qualifier)
"The patient notes that several relatives struggled with obesity, particularly ""relatives"" and ""Patient"" are (Person); ""struggled with obesity"" is (Finding) and ""struggled"" a (Severity Qualifier) and refers to ""relatives"" (Person).",relative : (Person); Patient : (Person); struggled with obesity : (Finding); struggled : (Severity Qualifier)
"The patient mentions that both aunts had a history of smoking where ""aunts"" and ""Patient"" are (Person); ""history of smoking"" is (Finding) and ""history"" a (Severity Qualifier) and refers to ""aunts"" (Person)",Patient: (Person); aunts: (Person); history of smoking: (Finding); history: (Severity Qualifier)
"The patient states that both grandparents suffered from diabetes where ""grandparents"" and ""Patient"" are (Person); ""suffered from diabetes"" is (Finding) and ""suffered"" a (Severity Qualifier) and refers to ""grandparents"" (Person)",Patient: (Person); grandparents: (Person); suffered from diabetes: (Finding); suffered: (Severity Qualifier)
"The patient indicates that one uncle had a history of heart disease where ""uncle"" and ""Patient"" are (Person); ""history of heart disease"" is (Finding) and ""history"" a (Severity Qualifier) and refers to ""uncle"" (Person)",Patient: (Person); uncle: (Person); history of heart disease: (Finding); history: (Severity Qualifier)
"The patient observes that both cousins faced issues with obesity where ""cousins"" and ""Patient"" are (Person); ""issues with obesity"" is (Finding) and ""issues"" a (Severity Qualifier) and refers to ""cousins"" (Person)",Patient: (Person); cousins: (Person); issues with obesity: (Finding); issues: (Severity Qualifier)
"The patient reports that their brother had a history of hypertension where ""brother"" and ""Patient"" are (Person); ""history of hypertension"" is (Finding) and ""history"" a (Severity Qualifier) and refers to ""brother"" (Person)",Patient: (Person); brother: (Person); history of hypertension: (Finding); history: (Severity Qualifier)
"The individual mentions that both aunts had a history of smoking where ""aunts"" and ""Individual"" are (Person); ""history of smoking"" is (Finding) and ""history"" a (Severity Qualifier) and refers to ""aunts"" (Person)",Individual : (Person); aunts : (Person); history of smoking : (Finding); history : (Severity Qualifier)
"The patient states that both aunts had a history of smoking, where ""aunts"" and ""Patient"" are (Person); ""history of smoking"" is (Finding) and ""history"" a (Severity Qualifier) and refers to ""aunts"" (Person)",Patient : (Person); aunts : (Person); history of smoking : (Finding); history : (Severity Qualifier)
"The patient mentions that his brother suffered from obesity, where ""brother"" and ""Patient"" are (Person); ""obesity"" is (Finding) and ""suffered from"" a (Severity Qualifier) and refers to ""brother"" (Person)",Patient : (Person); brother : (Person); obesity : (Finding); suffered from : (Severity Qualifier)
"The patient reveals that her mother experienced depression, where ""mother"" and ""Patient"" are (Person); ""depression"" is (Finding) and ""experienced"" a (Severity Qualifier) and refers to ""mother"" (Person)",Patient : (Person); mother : (Person); depression : (Finding); experienced : (Severity Qualifier)
"The patient discloses that his father was diagnosed with diabetes, where ""father"" and ""Patient"" are (Person); ""diagnosed with diabetes"" is (Finding) and ""diagnosed"" a (Severity Qualifier) and refers to ""father"" (Person)",Patient : (Person); father : (Person); diagnosed with diabetes : (Finding); diagnosed : (Severity Qualifier)
"The individual indicates that both parents had hypertension, where ""parents"" and ""individual"" are (Person); ""hypertension"" is (Finding) and ""high"" is a (Severity Qualifier) and refers to ""parents"" (Person).",individual : (Person); parents : (Person); hypertension : (Finding); high : (Severity Qualifier)
"The individual indicates that their uncle suffered from hypertension while their aunt has a history of diabetes, where ""uncle"" and ""aunt"" are (Person); ""hypertension"" and ""diabetes"" are (Finding) and ""suffered"" is a (Severity Qualifier) referring to ""uncle"" (Person).",uncle : (Person); aunt : (Person); hypertension : (Finding); diabetes : (Finding); suffered : (Severity Qualifier)
"The individual states that both parents suffered from hypertension where ""parents"" and ""individual"" are (Person); ""hypertension"" is (Finding) and ""suffered"" is a (Severity Qualifier) and refers to ""parents"" (Person)",individual : (Person); parents : (Person); hypertension : (Finding); suffered : (Severity Qualifier)
The individual states that both uncles had elevated blood pressure.,individual : (Person); uncles : (Person); elevated blood pressure : (Finding); elevated : (Severity Qualifier) and refers to uncles : (Person)
The patient mentions that his father suffered from type 2 diabetes.,patient : (Person); father : (Person); type 2 diabetes : (Finding)
She notes that her sister experienced severe migraines.,she : (Person); sister : (Person); severe migraines : (Finding); severe : (Severity Qualifier) and refers to sister : (Person)
The client reports that both aunts had high blood sugar levels.,client : (Person); aunts : (Person); high blood sugar levels : (Finding); high : (Severity Qualifier) and refers to aunts : (Person)
"The patient states that her aunt has a history of hypertension, and ""aunt"" and ""Patient"" are (Person); ""hypertension"" is (Finding) and ""history of"" is a (Severity Qualifier) and refers to ""aunt"" (Person).",aunt : (Person); Patient : (Person); hypertension : (Finding); history of : (Severity Qualifier)
"The patient mentions that his uncle suffered from severe asthma, where ""uncle"" and ""Patient"" are (Person); ""severe asthma"" is (Finding) and ""severe"" is a (Severity Qualifier) and refers to ""uncle"" (Person).",uncle : (Person); Patient : (Person); severe asthma : (Finding); severe : (Severity Qualifier)
"The patient indicates that her mother had a significant issue with diabetes, where ""mother"" and ""Patient"" are (Person); ""significant issue with diabetes"" is (Finding) and ""significant"" is a (Severity Qualifier) and refers to ""mother"" (Person).",mother : (Person); Patient : (Person); significant issue with diabetes : (Finding); significant : (Severity Qualifier)
"The patient recalls that his brother experienced critical renal failure, where ""brother"" and ""Patient"" are (Person); ""critical renal failure"" is (Finding) and ""critical"" is a (Severity Qualifier) and refers to ""brother"" (Person).",brother : (Person); Patient : (Person); critical renal failure : (Finding); critical : (Severity Qualifier)
"The individual states that her mother had hypertension while her father had diabetes, where ""mother"" and ""father"" are (Person); ""hypertension"" is (Finding) and ""had"" is a (Severity Qualifier) and refers to ""mother"" (Person).",mother : (Person); father : (Person); hypertension : (Finding); had : (Severity Qualifier)
"The subject indicates that his uncle suffered from obesity and his aunt had asthma, where ""uncle"" and ""aunt"" are (Person); ""obesity"" and ""asthma"" are (Finding) and ""suffered"" and ""had"" are (Severity Qualifier) referring to ""uncle"" and ""aunt"" (Person).",uncle : (Person); aunt : (Person); obesity : (Finding); asthma : (Finding); suffered : (Severity Qualifier); had : (Severity Qualifier)
"The patient mentions that her sister was diagnosed with high blood pressure and her brother with high triglycerides, where ""sister"" and ""brother"" are (Person); ""high blood pressure"" and ""high triglycerides"" are (Finding) and ""diagnosed"" is a (Severity Qualifier) referring to ""sister"" and ""brother"" (Person).",sister : (Person); brother : (Person); high blood pressure : (Finding); high triglycerides : (Finding); diagnosed : (Severity Qualifier)
"The patient states that her father had hypertension and her mother suffered from diabetes, where ""father"" and ""mother"" are (Person); ""hypertension"" and ""diabetes"" are (Finding) and ""suffered from"" is a (Severity Qualifier) and refers to ""mother"" (Person)",father : (Person); mother : (Person); hypertension : (Finding); diabetes : (Finding); suffered from : (Severity Qualifier)
The individual states that both uncles suffered from elevated blood pressure.,individual : (Person); uncles : (Person); elevated blood pressure : (Finding); elevated : (Severity Qualifier) and refers to uncles : (Person)
"This is a 65-year-old female patient with a personal history of hypertension and obesity, currently managed with medication, and no significant family medical history.",patient : (Person); hypertension : (Finding); obesity : (Finding)
"The subject has a younger sister in good health, but a maternal aunt aged 45 years who was diagnosed with breast cancer at 40 years following a mammogram.",subject : (Person); sister : (Person); aunt : (Person); breast cancer : (Finding)
"On evaluation, she weighed 95 kg and stood 1.65 m tall, resulting in a BMI of 34.9 kg/m2. Blood pressure was recorded at 130/85. Recent lab results indicated cholesterol levels at 210 mg/dL and triglycerides at 180 mg/dL, with HDL cholesterol measuring 50 mg/dL.",she : (Person); cholesterol : (Finding); triglycerides : (Finding); HDL cholesterol : (Finding)
"The individual indicates that their mother and father both had hypertension, where ""mother"" and ""father"" are (Person); ""hypertension"" is (Finding) and ""high"" is a (Severity Qualifier) and refers to ""mother"" (Person).",mother : (Person); father : (Person); hypertension : (Finding); high : (Severity Qualifier)
The individual states that both uncles suffered from hypertension.,individual : (Person); uncles : (Person); hypertension : (Finding); suffered : (Severity Qualifier) and refers to uncles : (Person)
"This is a 65-year-old female patient with a personal history of hypertension and hyperlipidemia managed with medication, with a significant family history of heart disease.",patient : (Person); hypertension : (Finding); hyperlipidemia : (Finding); medication : (Finding); family : (Person)
"The subject mentions that their father experienced diabetes complications, while their mother maintained a healthy lifestyle.",subject : (Person); father : (Person); diabetes complications : (Finding); mother : (Person); healthy lifestyle : (Finding)
"This is a 55-year-old male with a history of obesity and cardiovascular issues, with a family background of stroke incidents.",male : (Person); obesity : (Finding); cardiovascular issues : (Finding); family : (Person); stroke incidents : (Finding)
The patient indicates that their brother was diagnosed with asthma and that their sister has no significant health issues.,patient : (Person); brother : (Person); asthma : (Finding); sister : (Person); significant health issues : (Finding)
"""He mentioned that his mother faced challenges with diabetes while his father had issues related to high blood pressure, noting that these conditions are prevalent in their family history.""",mother : (Person); father : (Person); diabetes : (Finding); high blood pressure : (Finding)
"""The patient mentioned that her mother had a history of diabetes and that her father battled high blood pressure. She also noted that both her grandparents experienced similar health issues, which she believes have influenced her own health journey.""","""patient"" : (Person); ""mother"" : (Person); ""father"" : (Person); ""grandparents"" : (Person); ""diabetes"" : (Finding); ""high blood pressure"" : (Finding)"
"""The individual mentioned that their mother and father both faced challenges with diabetes, noting that 'grandparents' and 'Individual' are affected by this condition.""","""grandparents"" : (Person); ""Individual"" : (Person); ""diabetes"" : (Finding)"
"""He mentioned that his family has a history of diabetes, where both his uncles and himself have faced challenges related to blood sugar control.""","""uncles"" : (Person); ""himself"" : (Person); ""diabetes"" : (Finding) refers to ""uncles"" (Person)"
"""He mentioned that his family has a history of diabetes where 'grandparents' and 'Patient' are (Person); 'diabetes' is (Finding) and refers to 'grandparents' (Person). He indicated that he has been experiencing fatigue and frequent urination for the past three weeks, attributing these symptoms to poor dietary choices, sedentary lifestyle, and high-stress levels. He was evaluated after his doctor observed unusual blood sugar levels during a routine check-up.""",grandparent : (Person); Patient : (Person); diabetes : (Finding);
"Patient states that both grandparents had issues with diabetes where ""grandparents"" and ""Patient"" are (Person); ""diabetes"" is (Finding) and refers to ""grandparents"" (Person)",grandparents : (Person); Patient : (Person); diabetes : (Finding)
"The patient mentioned that her mother has a history of hypertension, which she attributes to ""family genetics"" and ""lifestyle choices.""",mother : (Person); patient : (Person); hypertension : (Finding); family genetics : (Finding); lifestyle choices : (Finding)
"""The patient disclosed that her mother had a history of diabetes and her father had high cholesterol, indicating a family history of metabolic disorders.""","""mother"" : (Person); ""father"" : (Person); ""diabetes"" : (Finding); ""high cholesterol"" : (Finding)"
"""He expressed that he has been facing challenges with his diet since he started working night shifts, attributing his poor eating habits to irregular meal times, fatigue, and stress.""","""he"" : (Person); ""night shifts"" : (Finding); ""poor eating habits"" : (Finding)"
"""The child was brought in after the parents noticed significant changes in his energy levels and eating habits, reporting that he often feels tired and has been skipping meals.""","""child"" : (Person); ""parents"" : (Person); ""energy levels"" : (Finding); ""eating habits"" : (Finding)"
"""She mentioned that her mother had experienced hypertension and her father dealt with heart disease, which raises concerns about her own health.""","""mother"" : (Person); ""father"" : (Person); ""hypertension"" : (Finding); ""heart disease"" : (Finding)"
"""The patient mentioned that both siblings have dealt with weight issues, while her 'aunt' and 'patient' are (Person); 'weight issues' is (Finding) and refers to 'siblings' (Person).""",'patient' : (Person); 'siblings' : (Person); 'weight issues' : (Finding)
"""The patient expressed that her mother dealt with diabetes and her father had high cholesterol, which she believes could affect her health. She mentioned that she has experienced mood swings and fatigue since starting a new job, which she attributes to stress, poor sleep, and irregular meals.""","""mother"" : (Person); ""father"" : (Person); ""diabetes"" : (Finding); ""high cholesterol"" : (Finding); ""patient"" : (Person)"
The father reports that both children have been suffering from allergies.,father : (Person); children : (Person); allergies : (Finding)
Her father had a background of respiratory issues.,father : (Person); respiratory issues : (Finding)
Medical history reveals that his uncle was diagnosed with pneumonia.,uncle : (Person); pneumonia : (Finding)
Family records show a history of asthma in the mother's side.,mother : (Person); asthma : (Finding)
The patient states that her two cousins have been treated for eczema.,patient : (Person); cousins : (Person); eczema : (Finding)
The individual reports that both parents have a history of diabetes.,"individual : (Person); parents : (Person); diabetes : (Finding) and refers to ""parents"" (Person)"
Her uncle had a family history of hypertension.,"her : (Person); uncle : (Person); hypertension : (Finding) and refers to ""uncle"" (Person)"
"Family history: both brothers aged four and eight years are healthy, and one sister who passed away at six months due to a serious cardiovascular issue.","Family : (Person); brothers : (Person); sister : (Person); cardiovascular issue : (Finding) and refers to ""sister"" (Person)"
The father states that both children have been treated for eczema.,"children : (Person); father : (Person); eczema : (Finding) and refers to ""children"" (Person)"
Her grandmother had a history of hypertension.,grandmother : (Person); hypertension : (Finding)
"Family history shows that both parents are free from diabetes, while one brother has been managing obesity.","parents : (Person); brother : (Person); diabetes : (Finding); obesity : (Finding) and refers to ""brother"" (Person)"
"The child reports that both parents have a history of allergies where ""parents"" and ""child"" are (Person); ""allergies"" is (Finding) and refers to ""parents"" (Person)",child : (Person); parents : (Person); allergies : (Finding)
"Her father has a significant background of eczema where ""father"" and ""Her"" are (Person); ""eczema"" is (Finding) and refers to ""father"" (Person)",Her : (Person); father : (Person); eczema : (Finding)
"The individual states that one sibling has been treated for hay fever where ""sibling"" and ""individual"" are (Person); ""hay fever"" is (Finding) and refers to ""sibling"" (Person)",individual : (Person); sibling : (Person); hay fever : (Finding)
"His aunt reveals that all cousins have suffered from eczema where ""aunt"" and ""cousins"" are (Person); ""eczema"" is (Finding) and refers to ""cousins"" (Person)",aunt : (Person); cousins : (Person); eczema : (Finding)
"The doctor notes that her two cousins suffer from allergies where ""cousins"" and ""Doctor"" are (Person); ""allergies"" is (Finding) and refers to ""cousins"" (Person)",Doctor : (Person); cousins : (Person); allergies : (Finding)
"His father reported a history of eczema in the family where ""father"" and ""Family"" are (Person); ""eczema"" is (Finding) and refers to ""family"" (Person)",father : (Person); family : (Person); eczema : (Finding)
"She states that her uncle has been treated for COPD where ""uncle"" and ""She"" are (Person); ""COPD"" is (Finding) and refers to ""uncle"" (Person)",She : (Person); uncle : (Person); COPD : (Finding)
"The researcher found that his aunt experiences migraines where ""aunt"" and ""researcher"" are (Person); ""migraines"" is (Finding) and refers to ""aunt"" (Person)",researcher : (Person); aunt : (Person); migraines : (Finding)
"The child reveals that her grandparents had a history of diabetes where ""grandparents"" and ""child"" are (Person); ""diabetes"" is (Finding) and refers to ""grandparents"" (Person)",child : (Person); grandparents : (Person); diabetes : (Finding)
The individual reports that both cousins have experienced respiratory issues.,individual : (Person); cousins : (Person); respiratory issues : (Finding)
Her father had a history of respiratory illnesses.,her : (Person); father : (Person); respiratory illnesses : (Finding)
Medical records show that both aunts suffered from severe allergies.,Medical records : (Finding); aunts : (Person); severe allergies : (Finding)
"Family background indicates healthy, non-consanguineous parents; one brother aged five years, healthy, and two sisters who faced complications due to a chronic lung disease.",Family background : (Finding); parents : (Person); brother : (Person); sisters : (Person); chronic lung disease : (Finding)
"The father reports that both children have experienced severe allergies where ""children"" and ""Father"" are (Person); ""allergies"" is (Finding) and refers to ""children"" (Person)",Father : (Person); children : (Person); allergies : (Finding)
"Her grandmother had a history of diabetes where ""grandmother"" and ""Her"" are (Person); ""diabetes"" is (Finding) and refers to ""grandmother"" (Person)",Her : (Person); grandmother : (Person); diabetes : (Finding)
"The caregiver states that all relatives had issues with hypertension where ""relatives"" and ""caregiver"" are (Person); ""hypertension"" is (Finding) and refers to ""relatives"" (Person)",caregiver : (Person); relatives : (Person); hypertension : (Finding)
The doctor notes that several relatives have experienced respiratory issues.,relative : (Person); doctor : (Person); respiratory issues : (Finding)
"The patient reports that both parents have a history of diabetes where ""parents"" and ""Patient"" are (Person); ""diabetes"" is (Finding) and refers to ""parents"" (Person)",Patient : (Person); parents : (Person); diabetes : (Finding)
"Her father had a family history of hypertension where ""father"" and ""Her"" are (Person); ""hypertension"" is (Finding) and refers to ""father"" (Person)",Her : (Person); father : (Person); hypertension : (Finding)
